{
  "$schema": "https://json-schema.org/draft/2020-12/schema",
  "$id": "https://github.com/PeterPonyu/dl-research/papers/FIGURE-INDEX.schema.json",
  "title": "Paper warehouse FIGURE-INDEX",
  "type": "object",
  "required": ["paper_id", "github", "zenodo_concept_doi", "pipeline", "figures"],
  "properties": {
    "paper_id": {
      "type": "string",
      "enum": ["A", "B", "C", "E1", "E2"]
    },
    "github": {
      "type": "string",
      "pattern": "^PeterPonyu/"
    },
    "zenodo_concept_doi": {
      "type": "string",
      "pattern": "^10\\.5281/zenodo\\.[0-9]+$"
    },
    "pipeline": {
      "type": "string",
      "pattern": "^figs/"
    },
    "figures": {
      "type": "array",
      "minItems": 1,
      "items": {
        "type": "object",
        "required": ["id", "label", "generator", "summary", "preview_svg", "tex_build", "vec_build"],
        "properties": {
          "id": { "type": "string" },
          "label": { "type": "string" },
          "generator": {
            "anyOf": [
              { "type": "null" },
              { "type": "string", "pattern": "^figs/" }
            ]
          },
          "summary": {
            "anyOf": [
              { "type": "null" },
              { "type": "string", "pattern": "^figs/" }
            ]
          },
          "preview_svg": {
            "anyOf": [
              { "type": "null" },
              { "type": "string", "pattern": "^figs/" }
            ]
          },
          "tex_build": {
            "anyOf": [
              { "type": "null" },
              { "type": "string", "pattern": "^figs/" }
            ]
          },
          "vec_build": {
            "anyOf": [
              { "type": "null" },
              { "type": "string", "pattern": "^figs/" }
            ]
          },
          "caption": { "type": ["string", "null"] },
          "caption_panels": {
            "type": ["array", "null"],
            "items": { "type": "string" }
          },
          "venue_flat_name": { "type": ["string", "null"] }
        },
        "additionalProperties": true
      }
    }
  },
  "additionalProperties": true
}
